,title,views,date_time,video_link,thumbnail_link
0,Strategies To Find A Job FAST! | Job Hunt Tips | How People Get Good Jobs | GeeksforGeeks,481 views,21 hours ago,https://www.youtube.com/watch?v=rFXVb2-Rj5k,https://i.ytimg.com/vi/rFXVb2-Rj5k/hqdefault.jpg
1,Make your Resume Strong with these DSA Projects | Best DSA Projects for your Resume | GeeksforGeeks,1.5K views,1 day ago,https://www.youtube.com/watch?v=NjUteXHoOXk,https://i.ytimg.com/vi/NjUteXHoOXk/hqdefault.jpg
2,Top TECH TRENDS & CAREERS in 2024!!! GeeksforGeeks,724 views,6 days ago,https://www.youtube.com/watch?v=FAluaVzy4VM,https://i.ytimg.com/vi/NjUteXHoOXk/hqdefault.jpg
3,GeeksforGeeks Bloopers!! The Making of Quality Content,569 views,7 days ago,https://www.youtube.com/watch?v=zakV-wfdPYM,https://i.ytimg.com/vi/NjUteXHoOXk/hqdefault.jpg
4,APTITUDE & REASONING | GATE 2024 Ultimate Revision | PYQ and Sample Questions GATE,1.3K views,8 days ago,https://www.youtube.com/watch?v=CaAjf_RE9ew,https://i.ytimg.com/vi/NjUteXHoOXk/hqdefault.jpg
5,Meet The Youngest CTO Of India! | GeeksforGeeks,3.3K views,13 days ago,https://www.youtube.com/watch?v=5YlR3yZV9bE,https://i.ytimg.com/vi/NjUteXHoOXk/hqdefault.jpg
6,Top 3 Things College Students FEAR!!,49K views,2 weeks ago,https://www.youtube.com/watch?v=mOkFtGLA9q8,https://i.ytimg.com/vi/NjUteXHoOXk/hqdefault.jpg
7,DATA SCIENCE PROJECTS Made Easy with COLAB AI | Generative AI | GeeksforGeeks,835 views,2 weeks ago,https://www.youtube.com/watch?v=Gt5ZkoFrgyE,https://i.ytimg.com/vi/NjUteXHoOXk/hqdefault.jpg
8,Top VS Code EXTENSIONS and SHORTCUTS to Code Faster! GeeksforGeeks,948 views,3 weeks ago,https://www.youtube.com/watch?v=l-LJucxS8Mc,https://i.ytimg.com/vi/NjUteXHoOXk/hqdefault.jpg
9,LINKED LIST PRACTICE QUESTIONS | Operations on Linked List | DSA Problems | GeeksforGeeks,1K views,4 weeks ago,https://www.youtube.com/watch?v=TnV34Lfdk7k,https://i.ytimg.com/vi/NjUteXHoOXk/hqdefault.jpg
10,Three 90 Challenge - Q&A with Sandeep Jain Sir | GeeksforGeeks #commitwithgfg,3.2K views,4 weeks ago,https://www.youtube.com/watch?v=KyUbJ4aoIgQ,https://i.ytimg.com/vi/NjUteXHoOXk/hqdefault.jpg
11,"Secrets to CONSISTENCY, COMMITMENT, and CAREER SUCCESS! #commitwithgfg",2K views,1 month ago,https://www.youtube.com/watch?v=6jhkJoOnMCc,https://i.ytimg.com/vi/NjUteXHoOXk/hqdefault.jpg
12,2024 Will be the YEAR for CODERS!! #commitwithgfg,1.3K views,1 month ago,https://www.youtube.com/watch?v=Nozck3wIMCo,https://i.ytimg.com/vi/NjUteXHoOXk/hqdefault.jpg
13,WHAT IS LINKED LIST? | Linked List Data Structures | DSA Course | GeeksforGeeks,1.2K views,1 month ago,https://www.youtube.com/watch?v=MCG7S2fGUeU,https://i.ytimg.com/vi/NjUteXHoOXk/hqdefault.jpg
14,Three 90 Challenge !! Transform your 2024 with GeeksforGeeks #commitwithgfg,10K views,1 month ago,https://www.youtube.com/watch?v=Vtxq-yHdKpA,https://i.ytimg.com/vi/NjUteXHoOXk/hqdefault.jpg
15,10 Best PROGRAMMING LANGUAGES to Learn in 2024 | GeeksforGeeks,2.6K views,1 month ago,https://www.youtube.com/watch?v=ehXa1Hxxu3Y,https://i.ytimg.com/vi/NjUteXHoOXk/hqdefault.jpg
16,5 BEST GITHUB REPOSITORIES Every DEVELOPER Must Know! | GeeksforGeeks,1.6K views,1 month ago,https://www.youtube.com/watch?v=xvUopUeVS0U,https://i.ytimg.com/vi/NjUteXHoOXk/hqdefault.jpg
17,Ready to #commitwithgfg ?,27K views,1 month ago,https://www.youtube.com/watch?v=lbveOrbHgto,https://i.ytimg.com/vi/NjUteXHoOXk/hqdefault.jpg
18,How to Use GOOGLE COLAB | Google Colab Tutorials for Beginners | GeeksforGeeks,1.1K views,1 month ago,https://www.youtube.com/watch?v=TqqkZLHoY0o,https://i.ytimg.com/vi/NjUteXHoOXk/hqdefault.jpg
19,Journey from an SDE at PAYTM to MICROSOFT | Software Developer Experience | GeeksforGeeks,1.4K views,1 month ago,https://www.youtube.com/watch?v=0mRyTDhxe_s,https://i.ytimg.com/vi/NjUteXHoOXk/hqdefault.jpg
20,What is DEVOPS and DEPLOYMENT? | Importance and Role of DevOps in Web Development | GeeksforGeeks,700 views,1 month ago,https://www.youtube.com/watch?v=NoxexEfck3g,https://i.ytimg.com/vi/NjUteXHoOXk/hqdefault.jpg
21,GeeksforGeeks In a Review 2023 | GfG Rewind 2023,2.2K views,1 month ago,https://www.youtube.com/watch?v=q_kEa8oBo2A,https://i.ytimg.com/vi/NjUteXHoOXk/hqdefault.jpg
22,How to Implement PICTURE IN PICTURE (PIP) MODE in Flutter Apps | Flutter Projects | GeeksforGeeks,671 views,1 month ago,https://www.youtube.com/watch?v=eBEdJCsqusI,https://i.ytimg.com/vi/NjUteXHoOXk/hqdefault.jpg
23,How to Integrate RAZORPAY PAYMENT GATEWAY in your Flutter App | Flutter Projects | GeeksforGeeks,2.3K views,1 month ago,https://www.youtube.com/watch?v=1XFGgHunNrk,https://i.ytimg.com/vi/NjUteXHoOXk/hqdefault.jpg
24,Career in DATA ANALYTICS | Insights from a DATA ANALYST at AMERICAN EXPRESS | GeeksforGeeks,1.4K views,1 month ago,https://www.youtube.com/watch?v=1zHWzyI7TC0,https://i.ytimg.com/vi/1zHWzyI7TC0/hqdefault.jpg
25,All About WEB SECURITY | Web Security for Full Stack Developers | GeeksforGeeks,842 views,1 month ago,https://www.youtube.com/watch?v=578Pzg7tVF4,https://i.ytimg.com/vi/578Pzg7tVF4/hqdefault.jpg
26,What is VERSION CONTROL and GIT? Web Development Explained | GeeksforGeeks,733 views,2 months ago,https://www.youtube.com/watch?v=jxbGBOo4GDs,https://i.ytimg.com/vi/jxbGBOo4GDs/hqdefault.jpg
27,Build Your Own GUI CALENDAR with Tkinter in Python | Python Projects | GeeksforGeeks,788 views,2 months ago,https://www.youtube.com/watch?v=W2S8NnlJtgk,https://i.ytimg.com/vi/W2S8NnlJtgk/hqdefault.jpg
28,Implementing Simple and Custom ALERT DIALOG BOX in Flutter Apps | Flutter Projects | GeeksforGeeks,604 views,2 months ago,https://www.youtube.com/watch?v=b6iw6dLQ7AU,https://i.ytimg.com/vi/b6iw6dLQ7AU/hqdefault.jpg
29,How to EXTRACT AUDIO from VIDEO using Python | Python Projects | GeeksforGeeks,999 views,2 months ago,https://www.youtube.com/watch?v=SrPi0FrmGiE,https://i.ytimg.com/vi/SrPi0FrmGiE/hqdefault.jpg
30,How to Create LANGUAGE TRANSLATOR Application in Flutter | Flutter Projects | GeeksforGeeks,1.3K views,2 months ago,https://www.youtube.com/watch?v=CeupjFXlFiQ,https://i.ytimg.com/vi/CeupjFXlFiQ/hqdefault.jpg
31,🍷 WINE QUALITY PREDICTION using RANDOM FOREST Algorithm | Machine Learning Projects | GeeksforGeeks,877 views,2 months ago,https://www.youtube.com/watch?v=MyllYgc-kh8,https://i.ytimg.com/vi/MyllYgc-kh8/hqdefault.jpg
32,Create a QR CODE SCANNER and GENERATOR Application using Flutter | Flutter Projects | GeeksforGeeks,5.4K views,2 months ago,https://www.youtube.com/watch?v=hm5JfFhiXL8,https://i.ytimg.com/vi/hm5JfFhiXL8/hqdefault.jpg
33,Create AI DESKTOP VIRTUAL ASSISTANT using Python and Tkinter | Python Projects | GeeksforGeeks,2.5K views,2 months ago,https://www.youtube.com/watch?v=tZl1_AcC7Dw,https://i.ytimg.com/vi/tZl1_AcC7Dw/hqdefault.jpg
34,Graph Practice Problems | Graph Data Structure | DSA Course | GeeksforGeeks,1.3K views,2 months ago,https://www.youtube.com/watch?v=pCmsQVHYXK0,https://i.ytimg.com/vi/pCmsQVHYXK0/hqdefault.jpg
35,Face Detection using Python and OpenCV with webcam | Python Projects | GeeksforGeeks,1.6K views,2 months ago,https://www.youtube.com/watch?v=129exLkKeks,https://i.ytimg.com/vi/129exLkKeks/hqdefault.jpg
36,Plagiarism Detection using Python | Python Projects | GeeksforGeeks,1.3K views,2 months ago,https://www.youtube.com/watch?v=QFQItyHsxZY,https://i.ytimg.com/vi/QFQItyHsxZY/hqdefault.jpg
37,Weapon Detection Using Python-OpenCV | Python Projects | GeeksforGeeks,3.4K views,2 months ago,https://www.youtube.com/watch?v=xlcNMlyN34g,https://i.ytimg.com/vi/xlcNMlyN34g/hqdefault.jpg
38,TITANIC SURVIVAL PREDICTION using TensorFlow | Machine Learning Projects | GeeksforGeeks,1K views,2 months ago,https://www.youtube.com/watch?v=cRYSIR6LaNQ,https://i.ytimg.com/vi/cRYSIR6LaNQ/hqdefault.jpg
39,What is BACKEND DEVELOPMENT? | Explained in 60 seconds | Full Stack Concepts | GeeksforGeeks,1.2K views,2 months ago,https://www.youtube.com/watch?v=C2u6_wOYlPc,https://i.ytimg.com/vi/C2u6_wOYlPc/hqdefault.jpg
40,STOCK PRICE PREDICTION using Machine Learning📈 | Machine Learning Projects | GeeksforGeeks,11K views,2 months ago,https://www.youtube.com/watch?v=tn07dCSFOfQ,https://i.ytimg.com/vi/C2u6_wOYlPc/hqdefault.jpg
41,What is FRONTEND DEVELOPMENT? | Explained in 60 seconds | Full Stack Concepts | GeeksforGeeks,971 views,2 months ago,https://www.youtube.com/watch?v=IiM10iV_Zug,https://i.ytimg.com/vi/C2u6_wOYlPc/hqdefault.jpg
42,Air Quality Index Prediction in Python | Machine Learning Projects | GeeksforGeeks,3.3K views,2 months ago,https://www.youtube.com/watch?v=0myaZxl4XWw,https://i.ytimg.com/vi/C2u6_wOYlPc/hqdefault.jpg
43,TWITTER SENTIMENT ANALYSIS (NLP) | Machine Learning Projects | GeeksforGeeks,16K views,2 months ago,https://www.youtube.com/watch?v=4YGkfAd2iXM,https://i.ytimg.com/vi/C2u6_wOYlPc/hqdefault.jpg
44,Diabetes Prediction in Machine Learning using Python | Machine Learning Projects | GeeksforGeeks,3.7K views,2 months ago,https://www.youtube.com/watch?v=AxYgzie4x2E,https://i.ytimg.com/vi/C2u6_wOYlPc/hqdefault.jpg
45,Stack Practice Question | Parenthesis Checker | Learn DSA Concepts | GeeksforGeeks,797 views,2 months ago,https://www.youtube.com/watch?v=2ay2GCrmf9E,https://i.ytimg.com/vi/C2u6_wOYlPc/hqdefault.jpg
46,"Build a Stopwatch using HTML, CSS, and JS | GeeksforGeeks",872 views,2 months ago,https://www.youtube.com/watch?v=DR5tJWig0AQ,https://i.ytimg.com/vi/C2u6_wOYlPc/hqdefault.jpg
47,WHAT IS STACK? | Stack Data Structures | DSA Course | GeeksforGeeks,1.2K views,3 months ago,https://www.youtube.com/watch?v=lhhyE7NVcbg,https://i.ytimg.com/vi/C2u6_wOYlPc/hqdefault.jpg
48,Meet A Data Scientist with 5 Years+ Experience | Ft.Tavishi Jaglan | GeeksforGeeks,1.6K views,3 months ago,https://www.youtube.com/watch?v=4_u-xcfqpcA,https://i.ytimg.com/vi/4_u-xcfqpcA/hqdefault.jpg
49,Master Data Science Concepts: Apache Kafka in 60 Seconds | Data Science Crash Course | GeeksforGeeks,951 views,3 months ago,https://www.youtube.com/watch?v=Li0wAG3hORQ,https://i.ytimg.com/vi/Li0wAG3hORQ/hqdefault.jpg
50,Master Data Science Concepts: Apache Flume in 60 Seconds | Data Science Crash Course | GeeksforGeeks,720 views,3 months ago,https://www.youtube.com/watch?v=bdjQI-OBGk8,https://i.ytimg.com/vi/bdjQI-OBGk8/hqdefault.jpg
51,Master Data Science Concepts: Data Bricks in 60 Seconds | Data Science Crash Course | GeeksforGeeks,906 views,3 months ago,https://www.youtube.com/watch?v=d1Pn06Rc9QE,https://i.ytimg.com/vi/d1Pn06Rc9QE/hqdefault.jpg
52,Master Data Science Concepts: Apache Beam in 60 Seconds | Data Science Crash Course | GeeksforGeeks,921 views,3 months ago,https://www.youtube.com/watch?v=PjSA0Ru7_rI,https://i.ytimg.com/vi/PjSA0Ru7_rI/hqdefault.jpg
53,Master Data Science Concepts: Data Lake in 60 Seconds | Data Science Crash Course | GeeksforGeeks,1.3K views,3 months ago,https://www.youtube.com/watch?v=KGD-T3bhFEA,https://i.ytimg.com/vi/KGD-T3bhFEA/hqdefault.jpg
54,Choosing the Right Cloud Provider | AWS vs Azure vs GCP | GeeksforGeeks,2.7K views,3 months ago,https://www.youtube.com/watch?v=YbPnhezNaUE,https://i.ytimg.com/vi/YbPnhezNaUE/hqdefault.jpg
55,A Journey from NOKIA to PAYPAL | Ft. Palak Awasthi | GeeksforGeeks,3K views,3 months ago,https://www.youtube.com/watch?v=6UUTPA0l748,https://i.ytimg.com/vi/6UUTPA0l748/hqdefault.jpg
56,Make Best Team For ICC Cricket World 2023 | Practice Problem | GeeksforGeeks,449 views,3 months ago,https://www.youtube.com/watch?v=ItY3minkI3o,https://i.ytimg.com/vi/ItY3minkI3o/hqdefault.jpg
57,Interview Strategies for Freshers | GeeksforGeeks,5.4K views,3 months ago,https://www.youtube.com/watch?v=tmg6d3T_T6Q,https://i.ytimg.com/vi/tmg6d3T_T6Q/hqdefault.jpg
58,🏆 GeeksforGeeks Hack-A-Thon: World-cup-Wizard Edition 🌟,364 views,3 months ago,https://www.youtube.com/watch?v=2mW7tclj6mc,https://i.ytimg.com/vi/2mW7tclj6mc/hqdefault.jpg
59,Ace your DevOps interview | GeeksforGeeks,69K views,3 months ago,https://www.youtube.com/watch?v=I-J28pjrTc8,https://i.ytimg.com/vi/I-J28pjrTc8/hqdefault.jpg
60,How to Get Free Google Cloud Qwiklabs Credits | Google Cloud Bootcamp | GeeksforGeeks,7K views,4 months ago,https://www.youtube.com/watch?v=lf-eQH28eAw,https://i.ytimg.com/vi/lf-eQH28eAw/hqdefault.jpg
61,"GeeksforGeeks Community – Connect, Ask, Learn & Grow with Tech Geeks",828 views,4 months ago,https://www.youtube.com/watch?v=dMX0Bel8V94,https://i.ytimg.com/vi/dMX0Bel8V94/hqdefault.jpg
62,Become a SDET Expert with GeeksforGeeks,53K views,4 months ago,https://www.youtube.com/watch?v=PLxzWN08w54,https://i.ytimg.com/vi/PLxzWN08w54/hqdefault.jpg
63,Geeks Premier League 2023 | India's Biggest Content Writing Event | GeeksforGeeks,1.8K views,4 months ago,https://www.youtube.com/watch?v=e0DLnBRZRj0,https://i.ytimg.com/vi/e0DLnBRZRj0/hqdefault.jpg
64,Happy Engineer's Day To You All!,2.1K views,4 months ago,https://www.youtube.com/watch?v=g4M-zfzsqBg,https://i.ytimg.com/vi/e0DLnBRZRj0/hqdefault.jpg
65,Decoding the Modern Job Landscape | An HR Perspective | GeeksforGeeks,745 views,4 months ago,https://www.youtube.com/watch?v=w3ucO_5NHCU,https://i.ytimg.com/vi/e0DLnBRZRj0/hqdefault.jpg
66,Unlock GATE 2024 | GeeksforGeeks,22K views,4 months ago,https://www.youtube.com/watch?v=4TVPoMDU0Ts,https://i.ytimg.com/vi/e0DLnBRZRj0/hqdefault.jpg
67,We Stole This For You,7.2K views,5 months ago,https://www.youtube.com/watch?v=eVV0MO_IBnw,https://i.ytimg.com/vi/e0DLnBRZRj0/hqdefault.jpg
68,Career Advancement Test For EWS & PWD Candidates | Student Grant of INR 10 Lakh | GeeksforGeeks,6.1K views,5 months ago,https://www.youtube.com/watch?v=DpCJ74xg93E,https://i.ytimg.com/vi/DpCJ74xg93E/hqdefault.jpg
69,GfG Mobile App | Android & iOS | Download for Free,2.4K views,5 months ago,https://www.youtube.com/watch?v=Rsh8xd3aIqw,https://i.ytimg.com/vi/Rsh8xd3aIqw/hqdefault.jpg
70,🔒 Securing Your Data in the Cloud: GCP's Top SECURITY Features | GeesforGeeks,444 views,5 months ago,https://www.youtube.com/watch?v=rwLBsyQ4rO8,https://i.ytimg.com/vi/rwLBsyQ4rO8/hqdefault.jpg
71,GATE CSE Offline Classes | GATE 2024 Crash Course | Delhi NCR | GeeksforGeeks,18K views,5 months ago,https://www.youtube.com/watch?v=a9xiYYqbaHg,https://i.ytimg.com/vi/a9xiYYqbaHg/hqdefault.jpg
72,How to Build a To-Do Application in Flutter | GeeksforGeeks,944 views,5 months ago,https://www.youtube.com/watch?v=fNuURHd7POk,https://i.ytimg.com/vi/fNuURHd7POk/hqdefault.jpg
73,How to Use Google Sign-in With Firebase in Flutter | GeeksforGeeks,6.7K views,5 months ago,https://www.youtube.com/watch?v=MRb_2Kg0nRI,https://i.ytimg.com/vi/MRb_2Kg0nRI/hqdefault.jpg
74,Machine Learning on GCP | Harnessing the Power of AI | GeeksforGeeks,539 views,5 months ago,https://www.youtube.com/watch?v=KSTX28pUSeI,https://i.ytimg.com/vi/KSTX28pUSeI/hqdefault.jpg
75,GRAPH Data Structure | What is Graph? | DSA Course | GeeksforGeeks,3.1K views,5 months ago,https://www.youtube.com/watch?v=gTsoyORhqkg,https://i.ytimg.com/vi/gTsoyORhqkg/hqdefault.jpg
76,Handling Missing Values | Machine Learning | GeeksforGeeks,769 views,5 months ago,https://www.youtube.com/watch?v=yFJ2_phRslY,https://i.ytimg.com/vi/yFJ2_phRslY/hqdefault.jpg
77,Security Risks of Cloud Computing | GeeksforGeeks,1.3K views,5 months ago,https://www.youtube.com/watch?v=6lxKkdyvS6M,https://i.ytimg.com/vi/6lxKkdyvS6M/hqdefault.jpg
78,DSA Classroom Program with Placement Assistance | Now in Noida & Gurugram | GeeksforGeeks,132K views,5 months ago,https://www.youtube.com/watch?v=ACZoeLwm_fE,https://i.ytimg.com/vi/ACZoeLwm_fE/hqdefault.jpg
79,Free Cloud Bootcamp Sponsored by Google for Developers | GeeksforGeeks,2.3K views,6 months ago,https://www.youtube.com/watch?v=uXpOqQEw7Pc,https://i.ytimg.com/vi/uXpOqQEw7Pc/hqdefault.jpg
80,All Your Queries Answered | DSA to Development Program | GeeksforGeeks,1.8K views,6 months ago,https://www.youtube.com/watch?v=kHBzDvj3D2U,https://i.ytimg.com/vi/kHBzDvj3D2U/hqdefault.jpg
81,10 TIPS and TRICKS to Crack Internships and Placements | GeeksforGeeks,877 views,6 months ago,https://www.youtube.com/watch?v=2QDMIZGeIC4,https://i.ytimg.com/vi/2QDMIZGeIC4/hqdefault.jpg
82,Complete School Guide for CBSE | Free Resources For School Students | GeeksforGeeks,639 views,6 months ago,https://www.youtube.com/watch?v=1ECMlxC6jbs,https://i.ytimg.com/vi/1ECMlxC6jbs/hqdefault.jpg
83,Master System Design | GeeksforGeeks,86K views,6 months ago,https://www.youtube.com/watch?v=vjWLZYeqiN8,https://i.ytimg.com/vi/vjWLZYeqiN8/hqdefault.jpg
84,"Unraveling the Geek-a-thon: The What, How, and Why | Geek-A-Thon | GeeksforGeeks",554 views,6 months ago,https://www.youtube.com/watch?v=6e0v_NhsFMQ,https://i.ytimg.com/vi/6e0v_NhsFMQ/hqdefault.jpg
85,Data Analysis Masterclass | Geek-A-Thon | GeeksforGeeks,839 views,6 months ago,https://www.youtube.com/watch?v=-7Emxpn8DXc,https://i.ytimg.com/vi/-7Emxpn8DXc/hqdefault.jpg
86,GeeksforGeeks Offline Classroom Program | Now Open In Noida & Gurgaon,42K views,6 months ago,https://www.youtube.com/watch?v=2bPiFkt3Nmg,https://i.ytimg.com/vi/2bPiFkt3Nmg/hqdefault.jpg
87,Kickstart your DevOps Career | GeeksforGeeks,112K views,6 months ago,https://www.youtube.com/watch?v=8gwwlpBwr_s,https://i.ytimg.com/vi/8gwwlpBwr_s/hqdefault.jpg
88,First Ever KBC at our Offline Classes | GeeksforGeeks,718 views,6 months ago,https://www.youtube.com/watch?v=chYg2EAKW2A,https://i.ytimg.com/vi/chYg2EAKW2A/hqdefault.jpg
89,Mega Job-a-thon for Working Professionals | 21st July | GeeksforGeeks,1.2K views,6 months ago,https://www.youtube.com/watch?v=CyOh-WDfUvs,https://i.ytimg.com/vi/CyOh-WDfUvs/hqdefault.jpg
90,How to Get Free Google Cloud Qwiklabs Credits | Google Cloud Bootcamp | GeeksforGeeks,7K views,4 months ago,https://www.youtube.com/watch?v=lf-eQH28eAw,https://i.ytimg.com/vi/lf-eQH28eAw/hqdefault.jpg
91,"GeeksforGeeks Community – Connect, Ask, Learn & Grow with Tech Geeks",828 views,4 months ago,https://www.youtube.com/watch?v=dMX0Bel8V94,https://i.ytimg.com/vi/dMX0Bel8V94/hqdefault.jpg
92,Become a SDET Expert with GeeksforGeeks,53K views,4 months ago,https://www.youtube.com/watch?v=PLxzWN08w54,https://i.ytimg.com/vi/PLxzWN08w54/hqdefault.jpg
93,Geeks Premier League 2023 | India's Biggest Content Writing Event | GeeksforGeeks,1.8K views,4 months ago,https://www.youtube.com/watch?v=e0DLnBRZRj0,https://i.ytimg.com/vi/e0DLnBRZRj0/hqdefault.jpg
94,Happy Engineer's Day To You All!,2.1K views,4 months ago,https://www.youtube.com/watch?v=g4M-zfzsqBg,https://i.ytimg.com/vi/g4M-zfzsqBg/hqdefault.jpg
95,Decoding the Modern Job Landscape | An HR Perspective | GeeksforGeeks,745 views,4 months ago,https://www.youtube.com/watch?v=w3ucO_5NHCU,https://i.ytimg.com/vi/w3ucO_5NHCU/hqdefault.jpg
96,Unlock GATE 2024 | GeeksforGeeks,22K views,4 months ago,https://www.youtube.com/watch?v=4TVPoMDU0Ts,https://i.ytimg.com/vi/4TVPoMDU0Ts/hqdefault.jpg
97,We Stole This For You,7.2K views,5 months ago,https://www.youtube.com/watch?v=eVV0MO_IBnw,https://i.ytimg.com/vi/eVV0MO_IBnw/hqdefault.jpg
98,Career Advancement Test For EWS & PWD Candidates | Student Grant of INR 10 Lakh | GeeksforGeeks,6.1K views,5 months ago,https://www.youtube.com/watch?v=DpCJ74xg93E,https://i.ytimg.com/vi/DpCJ74xg93E/hqdefault.jpg
99,GfG Mobile App | Android & iOS | Download for Free,2.4K views,5 months ago,https://www.youtube.com/watch?v=Rsh8xd3aIqw,https://i.ytimg.com/vi/Rsh8xd3aIqw/hqdefault.jpg
100,🔒 Securing Your Data in the Cloud: GCP's Top SECURITY Features | GeesforGeeks,444 views,5 months ago,https://www.youtube.com/watch?v=rwLBsyQ4rO8,https://i.ytimg.com/vi/rwLBsyQ4rO8/hqdefault.jpg
101,GATE CSE Offline Classes | GATE 2024 Crash Course | Delhi NCR | GeeksforGeeks,18K views,5 months ago,https://www.youtube.com/watch?v=a9xiYYqbaHg,https://i.ytimg.com/vi/a9xiYYqbaHg/hqdefault.jpg
102,How to Build a To-Do Application in Flutter | GeeksforGeeks,944 views,5 months ago,https://www.youtube.com/watch?v=fNuURHd7POk,https://i.ytimg.com/vi/fNuURHd7POk/hqdefault.jpg
103,How to Use Google Sign-in With Firebase in Flutter | GeeksforGeeks,6.7K views,5 months ago,https://www.youtube.com/watch?v=MRb_2Kg0nRI,https://i.ytimg.com/vi/MRb_2Kg0nRI/hqdefault.jpg
104,Machine Learning on GCP | Harnessing the Power of AI | GeeksforGeeks,539 views,5 months ago,https://www.youtube.com/watch?v=KSTX28pUSeI,https://i.ytimg.com/vi/KSTX28pUSeI/hqdefault.jpg
105,GRAPH Data Structure | What is Graph? | DSA Course | GeeksforGeeks,3.1K views,5 months ago,https://www.youtube.com/watch?v=gTsoyORhqkg,https://i.ytimg.com/vi/gTsoyORhqkg/hqdefault.jpg
106,Handling Missing Values | Machine Learning | GeeksforGeeks,769 views,5 months ago,https://www.youtube.com/watch?v=yFJ2_phRslY,https://i.ytimg.com/vi/yFJ2_phRslY/hqdefault.jpg
107,Security Risks of Cloud Computing | GeeksforGeeks,1.3K views,5 months ago,https://www.youtube.com/watch?v=6lxKkdyvS6M,https://i.ytimg.com/vi/6lxKkdyvS6M/hqdefault.jpg
108,DSA Classroom Program with Placement Assistance | Now in Noida & Gurugram | GeeksforGeeks,132K views,5 months ago,https://www.youtube.com/watch?v=ACZoeLwm_fE,https://i.ytimg.com/vi/ACZoeLwm_fE/hqdefault.jpg
109,Free Cloud Bootcamp Sponsored by Google for Developers | GeeksforGeeks,2.3K views,6 months ago,https://www.youtube.com/watch?v=uXpOqQEw7Pc,https://i.ytimg.com/vi/uXpOqQEw7Pc/hqdefault.jpg
110,All Your Queries Answered | DSA to Development Program | GeeksforGeeks,1.8K views,6 months ago,https://www.youtube.com/watch?v=kHBzDvj3D2U,https://i.ytimg.com/vi/kHBzDvj3D2U/hqdefault.jpg
111,10 TIPS and TRICKS to Crack Internships and Placements | GeeksforGeeks,877 views,6 months ago,https://www.youtube.com/watch?v=2QDMIZGeIC4,https://i.ytimg.com/vi/2QDMIZGeIC4/hqdefault.jpg
112,Complete School Guide for CBSE | Free Resources For School Students | GeeksforGeeks,639 views,6 months ago,https://www.youtube.com/watch?v=1ECMlxC6jbs,https://i.ytimg.com/vi/1ECMlxC6jbs/hqdefault.jpg
113,Master System Design | GeeksforGeeks,86K views,6 months ago,https://www.youtube.com/watch?v=vjWLZYeqiN8,https://i.ytimg.com/vi/vjWLZYeqiN8/hqdefault.jpg
114,"Unraveling the Geek-a-thon: The What, How, and Why | Geek-A-Thon | GeeksforGeeks",554 views,6 months ago,https://www.youtube.com/watch?v=6e0v_NhsFMQ,https://i.ytimg.com/vi/6e0v_NhsFMQ/hqdefault.jpg
115,Data Analysis Masterclass | Geek-A-Thon | GeeksforGeeks,839 views,6 months ago,https://www.youtube.com/watch?v=-7Emxpn8DXc,https://i.ytimg.com/vi/-7Emxpn8DXc/hqdefault.jpg
116,GeeksforGeeks Offline Classroom Program | Now Open In Noida & Gurgaon,42K views,6 months ago,https://www.youtube.com/watch?v=2bPiFkt3Nmg,https://i.ytimg.com/vi/2bPiFkt3Nmg/hqdefault.jpg
117,Kickstart your DevOps Career | GeeksforGeeks,112K views,6 months ago,https://www.youtube.com/watch?v=8gwwlpBwr_s,https://i.ytimg.com/vi/8gwwlpBwr_s/hqdefault.jpg
118,First Ever KBC at our Offline Classes | GeeksforGeeks,718 views,6 months ago,https://www.youtube.com/watch?v=chYg2EAKW2A,https://i.ytimg.com/vi/chYg2EAKW2A/hqdefault.jpg
119,Mega Job-a-thon for Working Professionals | 21st July | GeeksforGeeks,1.2K views,6 months ago,https://www.youtube.com/watch?v=CyOh-WDfUvs,https://i.ytimg.com/vi/CyOh-WDfUvs/hqdefault.jpg
120,Explore GeeksforGeeks Hiring Solutions | For Top Tech Companies | Innovative Hiring Solutions,638 views,7 months ago,https://www.youtube.com/watch?v=GDeoPHRqb5w,https://i.ytimg.com/vi/GDeoPHRqb5w/hqdefault.jpg
121,Geek-O-Lympics 2023 | GeeksforGeeks,3.4K views,7 months ago,https://www.youtube.com/watch?v=hLqJiIu6LzY,https://i.ytimg.com/vi/hLqJiIu6LzY/hqdefault.jpg
122,Web 3.0 Explained | GeeksforGeeks,2K views,7 months ago,https://www.youtube.com/watch?v=zEPRJMk3p90,https://i.ytimg.com/vi/zEPRJMk3p90/hqdefault.jpg
123,Geek-O-Lympics 2023 | 1st - 31st July | GeeksforGeeks,1.2K views,7 months ago,https://www.youtube.com/watch?v=GSqepfZLKU0,https://i.ytimg.com/vi/GSqepfZLKU0/hqdefault.jpg
124,What Is Web Scraping & What It Is Used For | How To Use Web Scraping | GeeksforGeeks,1.2K views,7 months ago,https://www.youtube.com/watch?v=MK15a0ipg-E,https://i.ytimg.com/vi/MK15a0ipg-E/hqdefault.jpg
125,Mega Job-A-Thon | Hire Top Talent for Your Company | GeeksforGeeks,1.3K views,7 months ago,https://www.youtube.com/watch?v=cWPqVVobUuA,https://i.ytimg.com/vi/cWPqVVobUuA/hqdefault.jpg
126,DSA To Development: A Complete Coding Guide | Complete Coding Program By GeeksforGeeks,171K views,7 months ago,https://www.youtube.com/watch?v=phr8lXH2Ee0,https://i.ytimg.com/vi/phr8lXH2Ee0/hqdefault.jpg
127,WHAT IS QUEUE? | Queue Data Structures | DSA Course | GeeksforGeeks,2.2K views,7 months ago,https://www.youtube.com/watch?v=ypJwoz_SXTo,https://i.ytimg.com/vi/ypJwoz_SXTo/hqdefault.jpg
128,QUEUE PRACTICE PROBLEMS | Queue Interview Questions | DSA Problems | GeeksforGeeks,1.6K views,7 months ago,https://www.youtube.com/watch?v=KG4dbF5xRig,https://i.ytimg.com/vi/KG4dbF5xRig/hqdefault.jpg
129,Free Summer Offline Classes on Python Programing | For Students Aged 14-21 | GeeksforGeeks,107K views,7 months ago,https://www.youtube.com/watch?v=OOLXHwZzHfM,https://i.ytimg.com/vi/OOLXHwZzHfM/hqdefault.jpg
130,Python Libraries | Data Science | GeeksforGeeks,2.3K views,8 months ago,https://www.youtube.com/watch?v=nDa75spDmeE,https://i.ytimg.com/vi/nDa75spDmeE/hqdefault.jpg
131,ITR Filing Made Simple | Documents require to file ITR | GeeksforGeeks,975 views,8 months ago,https://www.youtube.com/watch?v=SWa-tsbaIpg,https://i.ytimg.com/vi/SWa-tsbaIpg/hqdefault.jpg
132,Full Stack Development | LIVE Classes | GeeksforGeeks,213K views,8 months ago,https://www.youtube.com/watch?v=cBfC9HLR9Qk,https://i.ytimg.com/vi/cBfC9HLR9Qk/hqdefault.jpg
133,GeeksforGeeks Classroom Program in NCR,2.4K views,8 months ago,https://www.youtube.com/watch?v=uEhnTpHY26o,https://i.ytimg.com/vi/uEhnTpHY26o/hqdefault.jpg
134,WHAT IS ARRAY? | Array Data Structures | DSA Course | GeeksforGeeks,7.2K views,8 months ago,https://www.youtube.com/watch?v=3_x_Fb31NLE,https://i.ytimg.com/vi/3_x_Fb31NLE/hqdefault.jpg
